{
  "id": "evt_01jm6b0qa2rv8kfs",
  "type": "contact.created",
  "occurred_at": "2026-06-02T13:21:09Z",
  "tenant_id": "ten_01jm5wq0f8kavr3x",
  "version": "v1",
  "data": {
    "contact": {
      "id": "ctc_01jm5xb7r3n8tk2q",
      "tenant_id": "ten_01jm5wq0f8kavr3x",
      "first_name": "Marcus",
      "last_name": "Bell",
      "company_name": null,
      "email": "marcus.bell@example.com",
      "phone": "+1-555-0178",
      "address": {
        "line1": "917 Foxglove Court",
        "line2": null,
        "city": "Maplebrook",
        "region": "OH",
        "postal_code": "45803",
        "country": "US"
      },
      "created_at": "2026-06-02T13:21:09Z",
      "updated_at": "2026-06-02T13:21:09Z",
      "extensions": {}
    }
  }
}
